date,market,name,ticker,buy_low,buy_high,target,stop_loss,reason,style
2026-07-05,美股,Citigroup,C,133,144,160,126,"全球布局投資銀行，交易與投行業務隨市場活絡回溫，重整綜效顯現、資本回饋加碼。約 139.97 美元，7/2 金融類股領漲逾 2%，資金明顯輪動至銀行股，技術面轉強具波段動能。",短線波段
2026-07-05,美股,Kinross Gold,KGC,22,24.5,28,20.5,"全球主要黃金生產商，礦區分散、成本控制佳、自由現金流強。約 23.5 美元，6 月非農轉弱、降息預期升溫推升金價，避險與降息雙題材加持，為黃金族群強勢波段攻擊標的。",短線波段
2026-07-05,美股,PulteGroup,PHM,128,142,156,121,"美國第三大住宅建商，庫存去化順暢、獲利率穩健、財務結構佳。約 135 美元，6 月非農轉弱、降息預期升溫，房貸利率下行直接利多購屋需求，為利率敏感的降息受惠波段標的。",短線波段
2026-07-06,台股,第一金,2892.TW,30,34,38,28.5,"公股金控龍頭，銀行本業放款與企金、海外獲利穩定，資產品質佳、股利政策長期穩健。約32.4元，資金自AI晶片股輪動至中低價金融內需股，殖利率具吸引力，為攻守兼備的核心底倉。",穩健均衡
2026-07-06,台股,大成,1210.TW,54,60.5,66,51,"國內飼料與食品加工龍頭，肉品、雞蛋與冷凍食品內需穩定，垂直整合、獲利防禦性佳。約58元、本益比約14倍且連四日走高，內需食品於資金轉進防禦股時具支撐，適合中長線分批布局。",穩健均衡
2026-07-06,台股,台化,1326.TW,63,73,82,59,"台塑集團化纖與塑化龍頭，股價淨值比貼近歷史低檔、殖利率佳，具價值回歸空間。約68元，首度參展COMPUTEX、揭示切入化工與半導體材料轉型方向，傳產價值股於資金輪動下再評價，兼具防禦與題材。",穩健均衡
2026-07-06,美股,ExxonMobil,XOM,130,143,158,122,"國際綜合能源巨頭，上下游一體、圭亞那與二疊紀盆地產量成長、自由現金流強，股利連逾40年調升。約137美元、較高點回檔逾8%，能源類股於大輪動中改寫新高、評價具吸引力，為兼具高殖利率與抗通膨的能源核心持股。",穩健均衡
2026-07-06,美股,PepsiCo,PEP,135,148,165,128,"全球飲料與零食龍頭，品牌護城河深厚、訂價能力強、現金流穩定，股利連逾50年調升。約144美元、貼近52週低檔，資金轉進必需消費防禦股，估值修復空間大，為投組壓艙石。",穩健均衡
2026-07-06,美股,Merck,MRK,123,132,148,117,"全球製藥巨頭，Keytruda免疫腫瘤龍頭地位穩固、新藥線豐富，現金流充沛、殖利率佳。約130美元、技術面沿均線走多，醫療防禦族群於資金轉進防禦股時具支撐，為攻守兼備的醫療核心持股。",穩健均衡
2026-07-06,台股,欣興,3037.TW,930,1010,1180,880,"ABF載板三雄之一，AI GPU／ASIC／CPU需求推升高階載板供不應求、報價續揚。5月營收140.6億元創新高、前5月年增26.8%，花旗看好供給吃緊延續至2027並喊價1500元，為AI供應鏈題材強勢波段標的。",短線波段
2026-07-06,台股,長榮,2603.TW,178,205,232,168,"貨櫃航運龍頭，紅海繞道與旺季運價支撐獲利，本益比約8.5倍、殖利率誘人。7/3大漲5.12%收195元、量能放大，航運族群於資金自AI撤出時輪動轉強、法人買盤進駐，為題材與價值兼具的波段標的。",短線波段
2026-07-06,台股,華城,1519.TW,730,810,920,690,"重電三雄之一，受惠AI資料中心供電、美國電網升級與綠能併網超級循環，Q1獲利10億元、年增2成創同期高。約780元，重電為電力基建長多主流題材、在手訂單暢旺，為波段續強標的。",短線波段
2026-07-06,美股,Charles Schwab,SCHW,91,100,112,86,"美國最大折扣券商暨財富管理平台，市場活絡下經紀、利息與資產管理收入同步回溫，客戶資產規模創高。約97美元，資金明顯輪動至金融股、分析師平均目標價116美元，技術面轉強具波段動能。",短線波段
2026-07-06,美股,Wheaton Precious Metals,WPM,107,119,135,100,"全球最大貴金屬串流公司，商業模式輕資產、成本固定、毛利率高，直接受惠金價走升。約116美元、較高點回檔具切入空間，避險需求與潛在降息推升金價，UBS予買進、目標150美元，為黃金族群波段攻擊標的。",短線波段
2026-07-06,美股,RTX Corporation,RTX,188,206,228,178,"全球國防航太巨頭（雷神、普惠、Collins），在手訂單達2710億美元、飛彈交付年增逾40%，近一年漲近38%大幅超越大盤。約199美元，全球國防預算擴張與地緣風險支撐，技術面強勢、獲多家券商強力買進評等，為國防題材波段標的。",短線波段
